Welcome to the Address Book!

#Creating a database
mysql> CREATE database Address_Book_Service;
Query OK, 1 row affected (0.38 sec)

mysql> use Address_Book_Service;
Database changed

mysql> #Ability to create attributes
mysql> create table Address_Book_Table (FirstName VARCHAR(150),
    -> use Address_Book_Service;^C
mysql> create table Address_Book_Table (FirstName VARCHAR(150) NOT NULL, LastName VARCHAR(150) NOT NULL, 
       Address VARCHAR(100) NOT NULL, City VARCHAR(30) NOT NULL,State VARCHAR(30) NOT NULL, 
       Zip INT(6) NOT NULL, PhoneNumber INT(12) NOT NULL, EmailId VARCHAR(50) NOT NULL);
Query OK, 0 rows affected, 2 warnings (2.01 sec)

mysql> DESCRIBE Address_Book_Table;
+-------------+--------------+------+-----+---------+-------+
| Field       | Type         | Null | Key | Default | Extra |
+-------------+--------------+------+-----+---------+-------+
| FirstName   | varchar(150) | NO   |     | NULL    |       |
| LastName    | varchar(150) | NO   |     | NULL    |       |
| Address     | varchar(100) | NO   |     | NULL    |       |
| City        | varchar(30)  | NO   |     | NULL    |       |
| State       | varchar(30)  | NO   |     | NULL    |       |
| Zip         | int          | NO   |     | NULL    |       |
| PhoneNumber | int          | NO   |     | NULL    |       |
| EmailId     | varchar(50)  | NO   |     | NULL    |       |
+-------------+--------------+------+-----+---------+-------+
8 rows in set (0.10 sec)

#Ability to insert contacts in the address book
mysql> INSERT INTO address_book_table VALUES('Rahul', 'Kumar', '45A, XYZ Colony','Lucknow','UP', 879465, 2137984655, 'rahul@gmail.com'),
					    ('Tanya', 'Tiwari', '453P, New Market','Allahabad','UP', 878945, 2137456655, 'tanya@gmail.com'),
					    ('Anju', 'Sinha', '445H, ABCD Colony','Kanpur','UP', 963855, 879456213, 'anju@gmail.com'),
					    ('Sanya', 'Singh', '21A, ABC Colony','Kolkata','West Bengal', 123456, 2134568795, 'sanya@gmail.com');
Query OK, 1 row affected (0.59 sec)

mysql> select * from address_book_table;
+-----------+----------+-------------------+-----------+-------------+--------+-------------+-----------------+
| FirstName | LastName | Address           | City      | State       | Zip    | PhoneNumber | EmailId         |
+-----------+----------+-------------------+-----------+-------------+--------+-------------+-----------------+
| Rahul     | Kumar    | 45A, XYZ Colony   | Lucknow   | UP          | 879465 |  2137984655 | rahul@gmail.com |
| Tanya     | Tiwari   | 453P, New Market  | Allahabad | UP          | 878945 |  2137456655 | tanya@gmail.com |
| Anju      | Sinha    | 445H, ABCD Colony | Kanpur    | UP          | 963855 |   879456213 | anju@gmail.com  |
| Sanya     | Singh    | 21A, ABC Colony   | Kolkata   | West Bengal | 123456 |  2134568795 | sanya@gmail.com |
+-----------+----------+-------------------+-----------+-------------+--------+-------------+-----------------+
4 rows in set (0.10 sec)


#Ability to edit existing contact from the table

mysql> UPDATE address_book_table set Address='12 lane, MG Road' WHERE FirstName='Sanya';
Query OK, 1 row affected (0.13 sec)
Rows matched: 1  Changed: 1  Warnings: 0
mysql> select * from address_book_table;
+-----------+----------+-------------------+-----------+-------------+--------+-------------+-----------------+
| FirstName | LastName | Address           | City      | State       | Zip    | PhoneNumber | EmailId         |
+-----------+----------+-------------------+-----------+-------------+--------+-------------+-----------------+
| Rahul     | Kumar    | 45A, XYZ Colony   | Lucknow   | UP          | 879465 |  2137984655 | rahul@gmail.com |
| Tanya     | Tiwari   | 453P, New Market  | Allahabad | UP          | 878945 |  2137456655 | tanya@gmail.com |
| Anju      | Sinha    | 445H, ABCD Colony | Kanpur    | UP          | 963855 |   879456213 | anju@gmail.com  |
| Sanya     | Singh    | 12 lane, MG Road  | Kolkata   | West Bengal | 123456 |  2134568795 | sanya@gmail.com |
+-----------+----------+-------------------+-----------+-------------+--------+-------------+-----------------+
4 rows in set (0.10 sec)

#Delete a person using person's first name

mysql> DELETE FROM address_book_table WHERE FirstName='Sanya';
Query OK, 1 row affected (0.18 sec)

mysql> select * from address_book_table;
+-----------+----------+-------------------+-----------+-------+--------+-------------+-----------------+
| FirstName | LastName | Address           | City      | State | Zip    | PhoneNumber | EmailId         |
+-----------+----------+-------------------+-----------+-------+--------+-------------+-----------------+
| Rahul     | Kumar    | 45A, XYZ Colony   | Lucknow   | UP    | 879465 |  2137984655 | rahul@gmail.com |
| Tanya     | Tiwari   | 453P, New Market  | Allahabad | UP    | 878945 |  2137456655 | tanya@gmail.com |
| Anju      | Sinha    | 445H, ABCD Colony | Kanpur    | UP    | 963855 |  8794562513 | anju@gmail.com  |
+-----------+----------+-------------------+-----------+-------+--------+-------------+-----------------+
3 rows in set (0.00 sec)

#Ability to retrieve a person belonging to a city
mysql> SELECT * FROM address_book_table WHERE City='Lucknow';
+-----------+----------+-----------------+---------+-------+--------+-------------+-----------------+
| FirstName | LastName | Address         | City    | State | Zip    | PhoneNumber | EmailId         |
+-----------+----------+-----------------+---------+-------+--------+-------------+-----------------+
| Rahul     | Kumar    | 45A, XYZ Colony | Lucknow | UP    | 879465 |  2137984655 | rahul@gmail.com |
+-----------+----------+-----------------+---------+-------+--------+-------------+-----------------+
1 row in set (0.00 sec)

